round,speaker,coached_argument,opponent_argument,action,reward
0,coached,"Error generating coached argument: LLM API error: 429 {""error"":{""message"":""Rate limit exceeded: free-models-per-day. Add 10 credits to unlock 1000 free model requests per day"",""code"":429,""metadata"":{""headers"":{""X-RateLimit-Limit"":""50"",""X-RateLimit-Remain","Rebuttal: While remote work offers flexibility and potential cost savings for both employees and employers, it also presents significant challenges that may outweigh its benefits.

Firstly, the lack of face-to-face interaction in a remote setting can lead to feelings of isolation and decreased morale among employees. This can negatively impact productivity and overall job satisfaction. According to a study by Buffer in 2020, 20% of remote workers reported feeling lonely, compared to only 5% of office workers.

Secondly, the blurring of work-life boundaries can lead to burnout. With the home becoming both a workplace and a residence, employees may struggle to disconnect and recharge, ultimately leading to decreased productivity and well-being. A study by Stanford University found that remote work can increase stress levels and lead to longer work hours.

Thirdly, remote work can lead to a lack of collaboration and team cohesion. Without the ability to easily gather for meetings or brainstorming sessions, remote teams may struggle to align on goals and execute projects effectively. A study by Gallup found that remote workers are less likely to feel engaged with their work, with only 39% of remote workers reporting being engaged, compared to 51% of office workers.

In conclusion, while remote work offers some benefits, it also presents significant challenges that may outweigh its advantages. To truly determine whether remote work is better than office work, it is important to consider both the potential benefits and the potential drawbacks, and to prioritize the well-being and productivity of employees.",0,-4.0
